{
  "case_id": "R10",
  "decision": "route",
  "workflow_sequence": [
    "source-backed-form-fill"
  ],
  "reason": "All prerequisites for the authorized private field/value draft are available; autosaving provider entry is a different, excluded action.",
  "next_action": "Prepare the private field/value draft with control locators and source references. State that no filled native form is produced; do not type any answers into the autosaving provider fields.",
  "question": null,
  "prerequisites": [],
  "handoffs": [],
  "scope": "Planning only within the ten supplied workflows and this request; no external action."
}
