{
  "case_id": "R08",
  "decision": "route",
  "workflow_sequence": [
    "service-import-rehearsal"
  ],
  "reason": "The workflow fits, but import-ready operations depend on missing destination rules.",
  "next_action": "Inventory the source and draft a tentative mapping offline. Hold rule-dependent rows and the import-ready claim until the actual identity, create/update, and blank/clear contract is available.",
  "question": "Please supply the relevant destination import contract, including identity/upsert and blank/clear rules.",
  "prerequisites": [
    {
      "kind": "input",
      "detail": "Actual destination import contract"
    }
  ],
  "handoffs": [],
  "scope": "Planning only within the ten supplied workflows and this request; no external action."
}
