{
  "case_id": "R09",
  "decision": "route",
  "workflow_sequence": [
    "document-export-check"
  ],
  "reason": "The export workflow fits, but complete layout verification cannot be performed with the stated tools.",
  "next_action": "Prepare the source acceptance map and identify the text and link checks that the installed exporter/parser can support. Keep final delivery on hold for inspection of every output page; an exported candidate, if made, remains unverified for layout.",
  "question": null,
  "prerequisites": [
    {
      "kind": "capability",
      "detail": "An available page renderer or compatible visual viewer for every PDF page"
    }
  ],
  "handoffs": [],
  "scope": "Planning only within the ten supplied workflows and this request; no external action."
}
